{
  "spec_kind": "composition_spec",
  "id": "point-cloud-background-demo",
  "schema_version": "1.0.0",
  "recipe_id": "creative-motion",
  "pattern_ids": ["point-cloud-background"],
  "asset_ids": ["brand-portrait-cloud"],
  "required_sections": ["hero"],
  "sections": [
    {
      "section_id": "hero",
      "role": "first viewport offer and CTA over a decorative 2.5D point-cloud depth field",
      "node_ids": ["cloud-hero"],
      "evidence_ids": ["cloud-hero-evidence"]
    }
  ],
  "nodes": [
    {
      "node_id": "cloud-hero",
      "target_kind": "pattern",
      "target_id": "point-cloud-background",
      "section_id": "hero",
      "props": [
        {
          "name": "eyebrow",
          "value_type": "string",
          "string_value": "Studio RadeQ"
        },
        {
          "name": "headline",
          "value_type": "text",
          "string_value": "Rychlý web s živým prostorovým pozadím z bodů."
        },
        {
          "name": "primary_cta",
          "value_type": "string",
          "string_value": "Napsat poptávku"
        },
        {
          "name": "trust_cue",
          "value_type": "string",
          "string_value": "Odpovídám do 1 pracovního dne."
        },
        {
          "name": "cta_href",
          "value_type": "url",
          "string_value": "#kontakt"
        },
        {
          "name": "parallax_gain",
          "value_type": "string",
          "string_value": "1"
        },
        {
          "name": "scene_preset",
          "value_type": "string",
          "string_value": "photographic-drift"
        },
        {
          "name": "static_fallback_label",
          "value_type": "string",
          "string_value": "Statické prostorové pole se stejným textem a CTA"
        }
      ],
      "slot_fills": [
        {
          "slot": "point_cloud",
          "fills": [{ "target_kind": "asset", "target_id": "brand-portrait-cloud" }]
        }
      ],
      "declared_invariants": [
        "visible_h1",
        "dom_text_cta",
        "no_primary_content_in_canvas",
        "reduced_motion_fallback",
        "performance_budget"
      ],
      "evidence_ids": ["cloud-hero-evidence"]
    }
  ],
  "evidence": {
    "items": [
      {
        "id": "cloud-hero-evidence",
        "kind": "offer",
        "summary": "The first viewport keeps the offer headline, CTA, and trust cue as sharp DOM text; the faithful point-cloud depth field stays decorative behind it.",
        "pattern_ids": ["point-cloud-background"],
        "notes": "Read copy is DOM. The canvas is aria-hidden and stamped [data-point-cloud][data-cloud-contract]; the procedural engine freezes to a static home-pose frame under reduced motion. The stored cloud is gated by validatePointCloudScene."
      }
    ],
    "required_section_evidence": [
      {
        "section_id": "hero",
        "evidence_ids": ["cloud-hero-evidence"]
      }
    ]
  },
  "visual_qa_probe": {
    "url": "fixture://point-cloud-background-demo",
    "project_type": "portfolio",
    "primary_goal": "Win bespoke web/data/automation leads with a memorable, fast, accessible 2.5D opener.",
    "target_users": ["founder", "small-business", "tech-curious-customer"],
    "viewports": [
      {
        "name": "desktop-1440",
        "width": 1440,
        "height": 1000,
        "heading_count": 1,
        "cta_count": 1,
        "visible_text_characters": 180,
        "repeated_card_count": 0,
        "text_overlap": false,
        "horizontal_overflow": false,
        "low_contrast": false,
        "primary_content_in_canvas": false,
        "motion_level": 7,
        "reduced_motion_supported": true
      },
      {
        "name": "mobile-390",
        "width": 390,
        "height": 844,
        "heading_count": 1,
        "cta_count": 1,
        "visible_text_characters": 150,
        "repeated_card_count": 0,
        "text_overlap": false,
        "horizontal_overflow": false,
        "low_contrast": false,
        "primary_content_in_canvas": false,
        "motion_level": 7,
        "reduced_motion_supported": true
      }
    ],
    "headings": ["Rychlý web s živým prostorovým pozadím z bodů."],
    "ctas": ["Napsat poptávku"],
    "template_signals": []
  },
  "token_overrides": {
    "enabled": false,
    "values": []
  }
}
